15:12:42.094106 IP lamp-s-1vcpu-1gb-tor1-01.ssh > 198.96.85.21.63664: Flags [P.], seq 31327684:31327856, ack 17461, win 313, length 172
15:12:42.094163 IP lamp-s-1vcpu-1gb-tor1-01.ssh > 198.96.85.21.63664: Flags [P.], seq 31327856:31328028, ack 17461, win 313, length 172
15:12:42.094220 IP lamp-s-1vcpu-1gb-tor1-01.ssh > 198.96.85.21.63664: Flags [P.], seq 31328028:31328200, ack 17461, win 313, length 172
15:12:42.094275 IP lamp-s-1vcpu-1gb-tor1-01.ssh > 198.96.85.21.63664: Flags [P.], seq 31328200:31328372, ack 17461, win 313, length 172
15:12:42.094324 IP 198.96.85.21.63664 > lamp-s-1vcpu-1gb-tor1-01.ssh: Flags [.], ack 31315404, win 4123, length 0
15:12:42.094382 IP lamp-s-1vcpu-1gb-tor1-01.ssh > 198.96.85.21.63664: Flags [P.], seq 31328372:31328664, ack 17461, win 313, length 292
15:12:42.094441 IP lamp-s-1vcpu-1gb-tor1-01.ssh > 198.96.85.21.63664: Flags [P.], seq 31328664:31328836, ack 17461, win 313, length 172
15:12:42.094497 IP lamp-s-1vcpu-1gb-tor1-01.ssh > 198.96.85.21.63664: Flags [P.], seq 31328836:31329008, ack 17461, win 313, length 172
15:12:42.094552 IP lamp-s-1vcpu-1gb-tor1-01.ssh > 198.96.85.21.63664: Flags [P.], seq 31329008:31329180, ack 17461, win 313, length 172
15:12:42.094606 IP lamp-s-1vcpu-1gb-tor1-01.ssh > 198.96.85.21.63664: Flags [P.], seq 31329180:31329352, ack 17461, win 313, length 172
15:12:42.094661 IP lamp-s-1vcpu-1gb-tor1-01.ssh > 198.96.85.21.63664: Flags [P.], seq 31329352:31329524, ack 17461, win 313, length 172
15:12:42.094715 IP lamp-s-1vcpu-1gb-tor1-01.ssh > 198.96.85.21.63664: Flags [P.], seq 31329524:31329696, ack 17461, win 313, length 172
15:12:42.094776 IP lamp-s-1vcpu-1gb-tor1-01.ssh > 198.96.85.21.63664: Flags [P.], seq 31329696:31329868, ack 17461, win 313, length 172
15:12:42.094830 IP lamp-s-1vcpu-1gb-tor1-01.ssh > 198.96.85.21.63664: Flags [P.], seq 31329868:31330040, ack 17461, win 313, length 172
15:12:42.094884 IP lamp-s-1vcpu-1gb-tor1-01.ssh > 198.96.85.21.63664: Flags [P.], seq 31330040:31330212, ack 17461, win 313, length 172
15:12:42.094938 IP lamp-s-1vcpu-1gb-tor1-01.ssh > 198.96.85.21.63664: Flags [P.], seq 31330212:31330384, ack 17461, win 313, length 172
15:12:42.094993 IP lamp-s-1vcpu-1gb-tor1-01.ssh > 198.96.85.21.63664: Flags [P.], seq 31330384:31330556, ack 17461, win 313, length 172
15:12:42.095047 IP lamp-s-1vcpu-1gb-tor1-01.ssh > 198.96.85.21.63664: Flags [P.], seq 31330556:31330728, ack 17461, win 313, length 172
15:12:42.095100 IP lamp-s-1vcpu-1gb-tor1-01.ssh > 198.96.85.21.63664: Flags [P.], seq 31330728:31330900, ack 17461, win 313, length 172
15:12:42.095155 IP lamp-s-1vcpu-1gb-tor1-01.ssh > 198.96.85.21.63664: Flags [P.], seq 31330900:31331072, ack 17461, win 313, length 172
15:12:42.095209 IP lamp-s-1vcpu-1gb-tor1-01.ssh > 198.96.85.21.63664: Flags [P.], seq 31331072:31331244, ack 17461, win 313, length 172
15:12:42.095263 IP lamp-s-1vcpu-1gb-tor1-01.ssh > 198.96.85.21.63664: Flags [P.], seq 31331244:31331416, ack 17461, win 313, length 172
15:12:42.095318 IP lamp-s-1vcpu-1gb-tor1-01.ssh > 198.96.85.21.63664: Flags [P.], seq 31331416:31331588, ack 17461, win 313, length 172
15:12:42.095373 IP lamp-s-1vcpu-1gb-tor1-01.ssh > 198.96.85.21.63664: Flags [P.], seq 31331588:31331760, ack 17461, win 313, length 172
15:12:42.095427 IP lamp-s-1vcpu-1gb-tor1-01.ssh > 198.96.85.21.63664: Flags [P.], seq 31331760:31331932, ack 17461, win 313, length 172
15:12:42.095482 IP lamp-s-1vcpu-1gb-tor1-01.ssh > 198.96.85.21.63664: Flags [P.], seq 31331932:31332104, ack 17461, win 313, length 172
15:12:42.095537 IP lamp-s-1vcpu-1gb-tor1-01.ssh > 198.96.85.21.63664: Flags [P.], seq 31332104:31332276, ack 17461, win 313, length 172
15:12:42.095592 IP lamp-s-1vcpu-1gb-tor1-01.ssh > 198.96.85.21.63664: Flags [P.], seq 31332276:31332448, ack 17461, win 313, length 172
15:12:42.095663 IP lamp-s-1vcpu-1gb-tor1-01.ssh > 198.96.85.21.63664: Flags [P.], seq 31332448:31332620, ack 17461, win 313, length 172
15:12:42.095720 IP lamp-s-1vcpu-1gb-tor1-01.ssh > 198.96.85.21.63664: Flags [P.], seq 31332620:31332792, ack 17461, win 313, length 172
15:12:42.095775 IP lamp-s-1vcpu-1gb-tor1-01.ssh > 198.96.85.21.63664: Flags [P.], seq 31332792:31332964, ack 17461, win 313, length 172
15:12:42.095829 IP lamp-s-1vcpu-1gb-tor1-01.ssh > 198.96.85.21.63664: Flags [P.], seq 31332964:31333136, ack 17461, win 313, length 172
15:12:42.095886 IP lamp-s-1vcpu-1gb-tor1-01.ssh > 198.96.85.21.63664: Flags [P.], seq 31333136:31333308, ack 17461, win 313, length 172
15:12:42.095941 IP lamp-s-1vcpu-1gb-tor1-01.ssh > 198.96.85.21.63664: Flags [P.], seq 31333308:31333480, ack 17461, win 313, length 172
15:12:42.095996 IP lamp-s-1vcpu-1gb-tor1-01.ssh > 198.96.85.21.63664: Flags [P.], seq 31333480:31333652, ack 17461, win 313, length 172
15:12:42.096051 IP lamp-s-1vcpu-1gb-tor1-01.ssh > 198.96.85.21.63664: Flags [P.], seq 31333652:31333824, ack 17461, win 313, length 172
15:12:42.096106 IP lamp-s-1vcpu-1gb-tor1-01.ssh > 198.96.85.21.63664: Flags [P.], seq 31333824:31333996, ack 17461, win 313, length 172
15:12:42.096161 IP lamp-s-1vcpu-1gb-tor1-01.ssh > 198.96.85.21.63664: Flags [P.], seq 31333996:31334168, ack 17461, win 313, length 172
15:12:42.096215 IP lamp-s-1vcpu-1gb-tor1-01.ssh > 198.96.85.21.63664: Flags [P.], seq 31334168:31334340, ack 17461, win 313, length 172
15:12:42.096279 IP lamp-s-1vcpu-1gb-tor1-01.ssh > 198.96.85.21.63664: Flags [P.], seq 31334340:31334512, ack 17461, win 313, length 172
15:12:42.096380 IP lamp-s-1vcpu-1gb-tor1-01.ssh > 198.96.85.21.63664: Flags [P.], seq 31334512:31334684, ack 17461, win 313, length 172
15:12:42.096450 IP lamp-s-1vcpu-1gb-tor1-01.ssh > 198.96.85.21.63664: Flags [P.], seq 31334684:31334856, ack 17461, win 313, length 172
15:12:42.096508 IP lamp-s-1vcpu-1gb-tor1-01.ssh > 198.96.85.21.63664: Flags [P.], seq 31334856:31335028, ack 17461, win 313, length 172
15:12:42.096564 IP lamp-s-1vcpu-1gb-tor1-01.ssh > 198.96.85.21.63664: Flags [P.], seq 31335028:31335200, ack 17461, win 313, length 172
15:12:42.096619 IP lamp-s-1vcpu-1gb-tor1-01.ssh > 198.96.85.21.63664: Flags [P.], seq 31335200:31335372, ack 17461, win 313, length 172
15:12:42.096674 IP lamp-s-1vcpu-1gb-tor1-01.ssh > 198.96.85.21.63664: Flags [P.], seq 31335372:31335544, ack 17461, win 313, length 172
15:12:42.096728 IP lamp-s-1vcpu-1gb-tor1-01.ssh > 198.96.85.21.63664: Flags [P.], seq 31335544:31335716, ack 17461, win 313, length 172
15:12:42.096782 IP lamp-s-1vcpu-1gb-tor1-01.ssh > 198.96.85.21.63664: Flags [P.], seq 31335716:31335888, ack 17461, win 313, length 172
15:12:42.096839 IP lamp-s-1vcpu-1gb-tor1-01.ssh > 198.96.85.21.63664: Flags [P.], seq 31335888:31336060, ack 17461, win 313, length 172
15:12:42.096894 IP lamp-s-1vcpu-1gb-tor1-01.ssh > 198.96.85.21.63664: Flags [P.], seq 31336060:31336232, ack 17461, win 313, length 172
15:12:42.096949 IP lamp-s-1vcpu-1gb-tor1-01.ssh > 198.96.85.21.63664: Flags [P.], seq 31336232:31336404, ack 17461, win 313, length 172
15:12:42.097004 IP lamp-s-1vcpu-1gb-tor1-01.ssh > 198.96.85.21.63664: Flags [P.], seq 31336404:31336576, ack 17461, win 313, length 172
15:12:42.097065 IP lamp-s-1vcpu-1gb-tor1-01.ssh > 198.96.85.21.63664: Flags [P.], seq 31336576:31336748, ack 17461, win 313, length 172
15:12:42.097119 IP lamp-s-1vcpu-1gb-tor1-01.ssh > 198.96.85.21.63664: Flags [P.], seq 31336748:31336920, ack 17461, win 313, length 172
15:12:42.097174 IP lamp-s-1vcpu-1gb-tor1-01.ssh > 198.96.85.21.63664: Flags [P.], seq 31336920:31337092, ack 17461, win 313, length 172
15:12:42.097240 IP lamp-s-1vcpu-1gb-tor1-01.ssh > 198.96.85.21.63664: Flags [P.], seq 31337092:31337264, ack 17461, win 313, length 172
15:12:42.097326 IP lamp-s-1vcpu-1gb-tor1-01.ssh > 198.96.85.21.63664: Flags [P.], seq 31337264:31337436, ack 17461, win 313, length 172
15:12:42.097410 IP lamp-s-1vcpu-1gb-tor1-01.ssh > 198.96.85.21.63664: Flags [P.], seq 31337436:31337608, ack 17461, win 313, length 172
15:12:42.097470 IP lamp-s-1vcpu-1gb-tor1-01.ssh > 198.96.85.21.63664: Flags [P.], seq 31337608:31337780, ack 17461, win 313, length 172
15:12:42.097525 IP lamp-s-1vcpu-1gb-tor1-01.ssh > 198.96.85.21.63664: Flags [P.], seq 31337780:31337952, ack 17461, win 313, length 172
15:12:42.097581 IP lamp-s-1vcpu-1gb-tor1-01.ssh > 198.96.85.21.63664: Flags [P.], seq 31337952:31338124, ack 17461, win 313, length 172
15:12:42.097636 IP lamp-s-1vcpu-1gb-tor1-01.ssh > 198.96.85.21.63664: Flags [P.], seq 31338124:31338296, ack 17461, win 313, length 172
15:12:42.097690 IP lamp-s-1vcpu-1gb-tor1-01.ssh > 198.96.85.21.63664: Flags [P.], seq 31338296:31338468, ack 17461, win 313, length 172
15:12:42.097748 IP lamp-s-1vcpu-1gb-tor1-01.ssh > 198.96.85.21.63664: Flags [P.], seq 31338468:31338640, ack 17461, win 313, length 172
15:12:42.097805 IP lamp-s-1vcpu-1gb-tor1-01.ssh > 198.96.85.21.63664: Flags [P.], seq 31338640:31338812, ack 17461, win 313, length 172
15:12:42.097861 IP lamp-s-1vcpu-1gb-tor1-01.ssh > 198.96.85.21.63664: Flags [P.], seq 31338812:31338984, ack 17461, win 313, length 172
15:12:42.097915 IP lamp-s-1vcpu-1gb-tor1-01.ssh > 198.96.85.21.63664: Flags [P.], seq 31338984:31339156, ack 17461, win 313, length 172
15:12:42.097969 IP lamp-s-1vcpu-1gb-tor1-01.ssh > 198.96.85.21.63664: Flags [P.], seq 31339156:31339328, ack 17461, win 313, length 172
15:12:42.098023 IP lamp-s-1vcpu-1gb-tor1-01.ssh > 198.96.85.21.63664: Flags [P.], seq 31339328:31339500, ack 17461, win 313, length 172
15:12:42.098077 IP lamp-s-1vcpu-1gb-tor1-01.ssh > 198.96.85.21.63664: Flags [P.], seq 31339500:31339672, ack 17461, win 313, length 172
15:12:42.098131 IP lamp-s-1vcpu-1gb-tor1-01.ssh > 198.96.85.21.63664: Flags [P.], seq 31339672:31339844, ack 17461, win 313, length 172
15:12:42.098188 IP lamp-s-1vcpu-1gb-tor1-01.ssh > 198.96.85.21.63664: Flags [P.], seq 31339844:31340016, ack 17461, win 313, length 172
15:12:42.098223 IP 198.96.85.21.63664 > lamp-s-1vcpu-1gb-tor1-01.ssh: Flags [.], ack 31320908, win 4123, length 0
15:12:42.098249 IP 198.96.85.21.63664 > lamp-s-1vcpu-1gb-tor1-01.ssh: Flags [.], ack 31321372, win 4121, length 0
15:12:42.098254 IP 198.96.85.21.63664 > lamp-s-1vcpu-1gb-tor1-01.ssh: Flags [.], ack 31325276, win 4123, length 0
15:12:42.098375 IP lamp-s-1vcpu-1gb-tor1-01.ssh > 198.96.85.21.63664: Flags [P.], seq 31340016:31340532, ack 17461, win 313, length 516
15:12:42.098439 IP lamp-s-1vcpu-1gb-tor1-01.ssh > 198.96.85.21.63664: Flags [P.], seq 31340532:31340704, ack 17461, win 313, length 172
15:12:42.098497 IP lamp-s-1vcpu-1gb-tor1-01.ssh > 198.96.85.21.63664: Flags [P.], seq 31340704:31340876, ack 17461, win 313, length 172
15:12:42.098552 IP lamp-s-1vcpu-1gb-tor1-01.ssh > 198.96.85.21.63664: Flags [P.], seq 31340876:31341048, ack 17461, win 313, length 172
15:12:42.098608 IP lamp-s-1vcpu-1gb-tor1-01.ssh > 198.96.85.21.63664: Flags [P.], seq 31341048:31341220, ack 17461, win 313, length 172
15:12:42.098663 IP lamp-s-1vcpu-1gb-tor1-01.ssh > 198.96.85.21.63664: Flags [P.], seq 31341220:31341392, ack 17461, win 313, length 172
15:12:42.098718 IP lamp-s-1vcpu-1gb-tor1-01.ssh > 198.96.85.21.63664: Flags [P.], seq 31341392:31341564, ack 17461, win 313, length 172
15:12:42.098772 IP lamp-s-1vcpu-1gb-tor1-01.ssh > 198.96.85.21.63664: Flags [P.], seq 31341564:31341736, ack 17461, win 313, length 172
15:12:42.098826 IP lamp-s-1vcpu-1gb-tor1-01.ssh > 198.96.85.21.63664: Flags [P.], seq 31341736:31341908, ack 17461, win 313, length 172
15:12:42.098881 IP lamp-s-1vcpu-1gb-tor1-01.ssh > 198.96.85.21.63664: Flags [P.], seq 31341908:31342080, ack 17461, win 313, length 172
15:12:42.098906 IP 198.96.85.21.63664 > lamp-s-1vcpu-1gb-tor1-01.ssh: Flags [.], ack 31329868, win 4123, length 0
15:12:42.098980 IP lamp-s-1vcpu-1gb-tor1-01.ssh > 198.96.85.21.63664: Flags [P.], seq 31342080:31342372, ack 17461, win 313, length 292
15:12:42.099041 IP lamp-s-1vcpu-1gb-tor1-01.ssh > 198.96.85.21.63664: Flags [P.], seq 31342372:31342544, ack 17461, win 313, length 172
15:12:42.099096 IP lamp-s-1vcpu-1gb-tor1-01.ssh > 198.96.85.21.63664: Flags [P.], seq 31342544:31342716, ack 17461, win 313, length 172
15:12:42.099162 IP lamp-s-1vcpu-1gb-tor1-01.ssh > 198.96.85.21.63664: Flags [P.], seq 31342716:31342888, ack 17461, win 313, length 172
15:12:42.099253 IP lamp-s-1vcpu-1gb-tor1-01.ssh > 198.96.85.21.63664: Flags [P.], seq 31342888:31343060, ack 17461, win 313, length 172
15:12:42.099344 IP lamp-s-1vcpu-1gb-tor1-01.ssh > 198.96.85.21.63664: Flags [P.], seq 31343060:31343232, ack 17461, win 313, length 172
15:12:42.099427 IP lamp-s-1vcpu-1gb-tor1-01.ssh > 198.96.85.21.63664: Flags [P.], seq 31343232:31343404, ack 17461, win 313, length 172
15:12:42.099493 IP lamp-s-1vcpu-1gb-tor1-01.ssh > 198.96.85.21.63664: Flags [P.], seq 31343404:31343576, ack 17461, win 313, length 172
15:12:42.099553 IP lamp-s-1vcpu-1gb-tor1-01.ssh > 198.96.85.21.63664: Flags [P.], seq 31343576:31343748, ack 17461, win 313, length 172
15:12:42.099621 IP lamp-s-1vcpu-1gb-tor1-01.ssh > 198.96.85.21.63664: Flags [P.], seq 31343748:31343920, ack 17461, win 313, length 172
15:12:42.099724 IP lamp-s-1vcpu-1gb-tor1-01.ssh > 198.96.85.21.63664: Flags [P.], seq 31343920:31344092, ack 17461, win 313, length 172
15:12:42.099821 IP lamp-s-1vcpu-1gb-tor1-01.ssh > 198.96.85.21.63664: Flags [P.], seq 31344092:31344264, ack 17461, win 313, length 172
15:12:42.099890 IP lamp-s-1vcpu-1gb-tor1-01.ssh > 198.96.85.21.63664: Flags [P.], seq 31344264:31344436, ack 17461, win 313, length 172
15:12:42.099950 IP lamp-s-1vcpu-1gb-tor1-01.ssh > 198.96.85.21.63664: Flags [P.], seq 31344436:31344608, ack 17461, win 313, length 172
15:12:42.100007 IP lamp-s-1vcpu-1gb-tor1-01.ssh > 198.96.85.21.63664: Flags [P.], seq 31344608:31344780, ack 17461, win 313, length 172
15:12:42.100066 IP lamp-s-1vcpu-1gb-tor1-01.ssh > 198.96.85.21.63664: Flags [P.], seq 31344780:31344952, ack 17461, win 313, length 172
15:12:42.100122 IP lamp-s-1vcpu-1gb-tor1-01.ssh > 198.96.85.21.63664: Flags [P.], seq 31344952:31345124, ack 17461, win 313, length 172
15:12:42.100181 IP lamp-s-1vcpu-1gb-tor1-01.ssh > 198.96.85.21.63664: Flags [P.], seq 31345124:31345296, ack 17461, win 313, length 172
15:12:42.100237 IP lamp-s-1vcpu-1gb-tor1-01.ssh > 198.96.85.21.63664: Flags [P.], seq 31345296:31345468, ack 17461, win 313, length 172
15:12:42.100295 IP lamp-s-1vcpu-1gb-tor1-01.ssh > 198.96.85.21.63664: Flags [P.], seq 31345468:31345640, ack 17461, win 313, length 172
15:12:42.100352 IP lamp-s-1vcpu-1gb-tor1-01.ssh > 198.96.85.21.63664: Flags [P.], seq 31345640:31345812, ack 17461, win 313, length 172
15:12:42.100411 IP lamp-s-1vcpu-1gb-tor1-01.ssh > 198.96.85.21.63664: Flags [P.], seq 31345812:31345984, ack 17461, win 313, length 172
15:12:42.100480 IP lamp-s-1vcpu-1gb-tor1-01.ssh > 198.96.85.21.63664: Flags [P.], seq 31345984:31346156, ack 17461, win 313, length 172
15:12:42.100545 IP lamp-s-1vcpu-1gb-tor1-01.ssh > 198.96.85.21.63664: Flags [P.], seq 31346156:31346328, ack 17461, win 313, length 172
15:12:42.100610 IP lamp-s-1vcpu-1gb-tor1-01.ssh > 198.96.85.21.63664: Flags [P.], seq 31346328:31346500, ack 17461, win 313, length 172
15:12:42.100685 IP lamp-s-1vcpu-1gb-tor1-01.ssh > 198.96.85.21.63664: Flags [P.], seq 31346500:31346672, ack 17461, win 313, length 172
15:12:42.100748 IP lamp-s-1vcpu-1gb-tor1-01.ssh > 198.96.85.21.63664: Flags [P.], seq 31346672:31346844, ack 17461, win 313, length 172
15:12:42.100808 IP lamp-s-1vcpu-1gb-tor1-01.ssh > 198.96.85.21.63664: Flags [P.], seq 31346844:31347016, ack 17461, win 313, length 172
15:12:42.100881 IP lamp-s-1vcpu-1gb-tor1-01.ssh > 198.96.85.21.63664: Flags [P.], seq 31347016:31347188, ack 17461, win 313, length 172
15:12:42.100951 IP lamp-s-1vcpu-1gb-tor1-01.ssh > 198.96.85.21.63664: Flags [P.], seq 31347188:31347360, ack 17461, win 313, length 172
15:12:42.101022 IP lamp-s-1vcpu-1gb-tor1-01.ssh > 198.96.85.21.63664: Flags [P.], seq 31347360:31347532, ack 17461, win 313, length 172
15:12:42.101081 IP lamp-s-1vcpu-1gb-tor1-01.ssh > 198.96.85.21.63664: Flags [P.], seq 31347532:31347704, ack 17461, win 313, length 172
15:12:42.101138 IP lamp-s-1vcpu-1gb-tor1-01.ssh > 198.96.85.21.63664: Flags [P.], seq 31347704:31347876, ack 17461, win 313, length 172
15:12:42.101207 IP lamp-s-1vcpu-1gb-tor1-01.ssh > 198.96.85.21.63664: Flags [P.], seq 31347876:31348048, ack 17461, win 313, length 172
15:12:42.101218 IP 198.96.85.21.63664 > lamp-s-1vcpu-1gb-tor1-01.ssh: Flags [.], ack 31333136, win 4123, length 0
15:12:42.101224 IP 198.96.85.21.63664 > lamp-s-1vcpu-1gb-tor1-01.ssh: Flags [.], ack 31337436, win 4123, length 0
15:12:42.101338 IP lamp-s-1vcpu-1gb-tor1-01.ssh > 198.96.85.21.63664: Flags [P.], seq 31348048:31348452, ack 17461, win 313, length 404
15:12:42.101424 IP lamp-s-1vcpu-1gb-tor1-01.ssh > 198.96.85.21.63664: Flags [P.], seq 31348452:31348624, ack 17461, win 313, length 172
15:12:42.101483 IP lamp-s-1vcpu-1gb-tor1-01.ssh > 198.96.85.21.63664: Flags [P.], seq 31348624:31348796, ack 17461, win 313, length 172
15:12:42.101550 IP lamp-s-1vcpu-1gb-tor1-01.ssh > 198.96.85.21.63664: Flags [P.], seq 31348796:31348968, ack 17461, win 313, length 172
15:12:42.101609 IP lamp-s-1vcpu-1gb-tor1-01.ssh > 198.96.85.21.63664: Flags [P.], seq 31348968:31349140, ack 17461, win 313, length 172
15:12:42.101667 IP lamp-s-1vcpu-1gb-tor1-01.ssh > 198.96.85.21.63664: Flags [P.], seq 31349140:31349312, ack 17461, win 313, length 172
15:12:42.101727 IP lamp-s-1vcpu-1gb-tor1-01.ssh > 198.96.85.21.63664: Flags [P.], seq 31349312:31349484, ack 17461, win 313, length 172
15:12:42.101788 IP lamp-s-1vcpu-1gb-tor1-01.ssh > 198.96.85.21.63664: Flags [P.], seq 31349484:31349656, ack 17461, win 313, length 172
15:12:42.101844 IP lamp-s-1vcpu-1gb-tor1-01.ssh > 198.96.85.21.63664: Flags [P.], seq 31349656:31349828, ack 17461, win 313, length 172
15:12:42.101902 IP lamp-s-1vcpu-1gb-tor1-01.ssh > 198.96.85.21.63664: Flags [P.], seq 31349828:31350000, ack 17461, win 313, length 172
15:12:42.101958 IP lamp-s-1vcpu-1gb-tor1-01.ssh > 198.96.85.21.63664: Flags [P.], seq 31350000:31350172, ack 17461, win 313, length 172
15:12:42.102016 IP lamp-s-1vcpu-1gb-tor1-01.ssh > 198.96.85.21.63664: Flags [P.], seq 31350172:31350344, ack 17461, win 313, length 172
15:12:42.102072 IP lamp-s-1vcpu-1gb-tor1-01.ssh > 198.96.85.21.63664: Flags [P.], seq 31350344:31350516, ack 17461, win 313, length 172
15:12:42.102131 IP lamp-s-1vcpu-1gb-tor1-01.ssh > 198.96.85.21.63664: Flags [P.], seq 31350516:31350688, ack 17461, win 313, length 172
15:12:42.102220 IP lamp-s-1vcpu-1gb-tor1-01.ssh > 198.96.85.21.63664: Flags [P.], seq 31350688:31350860, ack 17461, win 313, length 172
15:12:42.102285 IP lamp-s-1vcpu-1gb-tor1-01.ssh > 198.96.85.21.63664: Flags [P.], seq 31350860:31351032, ack 17461, win 313, length 172
15:12:42.102342 IP lamp-s-1vcpu-1gb-tor1-01.ssh > 198.96.85.21.63664: Flags [P.], seq 31351032:31351204, ack 17461, win 313, length 172
15:12:42.102400 IP lamp-s-1vcpu-1gb-tor1-01.ssh > 198.96.85.21.63664: Flags [P.], seq 31351204:31351376, ack 17461, win 313, length 172
15:12:42.102457 IP lamp-s-1vcpu-1gb-tor1-01.ssh > 198.96.85.21.63664: Flags [P.], seq 31351376:31351548, ack 17461, win 313, length 172
15:12:42.102516 IP lamp-s-1vcpu-1gb-tor1-01.ssh > 198.96.85.21.63664: Flags [P.], seq 31351548:31351720, ack 17461, win 313, length 172
15:12:42.102572 IP lamp-s-1vcpu-1gb-tor1-01.ssh > 198.96.85.21.63664: Flags [P.], seq 31351720:31351892, ack 17461, win 313, length 172
15:12:42.102638 IP lamp-s-1vcpu-1gb-tor1-01.ssh > 198.96.85.21.63664: Flags [P.], seq 31351892:31352064, ack 17461, win 313, length 172
15:12:42.102695 IP lamp-s-1vcpu-1gb-tor1-01.ssh > 198.96.85.21.63664: Flags [P.], seq 31352064:31352236, ack 17461, win 313, length 172
15:12:42.102756 IP 198.96.85.21.63664 > lamp-s-1vcpu-1gb-tor1-01.ssh: Flags [.], ack 31340704, win 4123, length 0
15:12:42.102771 IP 198.96.85.21.63664 > lamp-s-1vcpu-1gb-tor1-01.ssh: Flags [.], ack 31344092, win 4123, length 0
15:12:42.102780 IP 198.96.85.21.63664 > lamp-s-1vcpu-1gb-tor1-01.ssh: Flags [.], ack 31345984, win 4123, length 0
15:12:42.102833 IP lamp-s-1vcpu-1gb-tor1-01.ssh > 198.96.85.21.63664: Flags [P.], seq 31352236:31352408, ack 17461, win 313, length 172
15:12:42.102899 IP lamp-s-1vcpu-1gb-tor1-01.ssh > 198.96.85.21.63664: Flags [P.], seq 31352408:31352924, ack 17461, win 313, length 516
15:12:42.102961 IP lamp-s-1vcpu-1gb-tor1-01.ssh > 198.96.85.21.63664: Flags [P.], seq 31352924:31353096, ack 17461, win 313, length 172
15:12:42.103018 IP lamp-s-1vcpu-1gb-tor1-01.ssh > 198.96.85.21.63664: Flags [P.], seq 31353096:31353268, ack 17461, win 313, length 172
15:12:42.103080 IP lamp-s-1vcpu-1gb-tor1-01.ssh > 198.96.85.21.63664: Flags [P.], seq 31353268:31353440, ack 17461, win 313, length 172
15:12:42.103158 IP lamp-s-1vcpu-1gb-tor1-01.ssh > 198.96.85.21.63664: Flags [P.], seq 31353440:31353612, ack 17461, win 313, length 172
15:12:42.103252 IP lamp-s-1vcpu-1gb-tor1-01.ssh > 198.96.85.21.63664: Flags [P.], seq 31353612:31353784, ack 17461, win 313, length 172
15:12:42.103333 IP lamp-s-1vcpu-1gb-tor1-01.ssh > 198.96.85.21.63664: Flags [P.], seq 31353784:31353956, ack 17461, win 313, length 172
15:12:42.103381 IP lamp-s-1vcpu-1gb-tor1-01.ssh > 198.96.85.21.63664: Flags [P.], seq 31353956:31354128, ack 17461, win 313, length 172
15:12:42.103444 IP lamp-s-1vcpu-1gb-tor1-01.ssh > 198.96.85.21.63664: Flags [P.], seq 31354128:31354300, ack 17461, win 313, length 172
15:12:42.103505 IP lamp-s-1vcpu-1gb-tor1-01.ssh > 198.96.85.21.63664: Flags [P.], seq 31354300:31354472, ack 17461, win 313, length 172
15:12:42.103562 IP lamp-s-1vcpu-1gb-tor1-01.ssh > 198.96.85.21.63664: Flags [P.], seq 31354472:31354644, ack 17461, win 313, length 172
15:12:42.103620 IP lamp-s-1vcpu-1gb-tor1-01.ssh > 198.96.85.21.63664: Flags [P.], seq 31354644:31354816, ack 17461, win 313, length 172
15:12:42.103699 IP lamp-s-1vcpu-1gb-tor1-01.ssh > 198.96.85.21.63664: Flags [P.], seq 31354816:31354988, ack 17461, win 313, length 172
15:12:42.103768 IP lamp-s-1vcpu-1gb-tor1-01.ssh > 198.96.85.21.63664: Flags [P.], seq 31354988:31355160, ack 17461, win 313, length 172
15:12:42.103825 IP lamp-s-1vcpu-1gb-tor1-01.ssh > 198.96.85.21.63664: Flags [P.], seq 31355160:31355332, ack 17461, win 313, length 172
15:12:42.103881 IP lamp-s-1vcpu-1gb-tor1-01.ssh > 198.96.85.21.63664: Flags [P.], seq 31355332:31355504, ack 17461, win 313, length 172
15:12:42.103935 IP lamp-s-1vcpu-1gb-tor1-01.ssh > 198.96.85.21.63664: Flags [P.], seq 31355504:31355676, ack 17461, win 313, length 172
15:12:42.103990 IP lamp-s-1vcpu-1gb-tor1-01.ssh > 198.96.85.21.63664: Flags [P.], seq 31355676:31355848, ack 17461, win 313, length 172
15:12:42.104044 IP lamp-s-1vcpu-1gb-tor1-01.ssh > 198.96.85.21.63664: Flags [P.], seq 31355848:31356020, ack 17461, win 313, length 172
15:12:42.104099 IP lamp-s-1vcpu-1gb-tor1-01.ssh > 198.96.85.21.63664: Flags [P.], seq 31356020:31356192, ack 17461, win 313, length 172
15:12:42.104153 IP lamp-s-1vcpu-1gb-tor1-01.ssh > 198.96.85.21.63664: Flags [P.], seq 31356192:31356364, ack 17461, win 313, length 172
15:12:42.104235 IP lamp-s-1vcpu-1gb-tor1-01.ssh > 198.96.85.21.63664: Flags [P.], seq 31356364:31356536, ack 17461, win 313, length 172
15:12:42.104322 IP lamp-s-1vcpu-1gb-tor1-01.ssh > 198.96.85.21.63664: Flags [P.], seq 31356536:31356708, ack 17461, win 313, length 172
15:12:42.104383 IP lamp-s-1vcpu-1gb-tor1-01.ssh > 198.96.85.21.63664: Flags [P.], seq 31356708:31356880, ack 17461, win 313, length 172
15:12:42.104464 IP lamp-s-1vcpu-1gb-tor1-01.ssh > 198.96.85.21.63664: Flags [P.], seq 31356880:31357052, ack 17461, win 313, length 172
15:12:42.104527 IP lamp-s-1vcpu-1gb-tor1-01.ssh > 198.96.85.21.63664: Flags [P.], seq 31357052:31357224, ack 17461, win 313, length 172
15:12:42.104587 IP lamp-s-1vcpu-1gb-tor1-01.ssh > 198.96.85.21.63664: Flags [P.], seq 31357224:31357396, ack 17461, win 313, length 172
15:12:42.104644 IP lamp-s-1vcpu-1gb-tor1-01.ssh > 198.96.85.21.63664: Flags [P.], seq 31357396:31357568, ack 17461, win 313, length 172
15:12:42.104699 IP lamp-s-1vcpu-1gb-tor1-01.ssh > 198.96.85.21.63664: Flags [P.], seq 31357568:31357740, ack 17461, win 313, length 172
15:12:42.104756 IP lamp-s-1vcpu-1gb-tor1-01.ssh > 198.96.85.21.63664: Flags [P.], seq 31357740:31357912, ack 17461, win 313, length 172
15:12:42.104811 IP lamp-s-1vcpu-1gb-tor1-01.ssh > 198.96.85.21.63664: Flags [P.], seq 31357912:31358084, ack 17461, win 313, length 172
15:12:42.104865 IP lamp-s-1vcpu-1gb-tor1-01.ssh > 198.96.85.21.63664: Flags [P.], seq 31358084:31358256, ack 17461, win 313, length 172
15:12:42.104921 IP lamp-s-1vcpu-1gb-tor1-01.ssh > 198.96.85.21.63664: Flags [P.], seq 31358256:31358428, ack 17461, win 313, length 172
15:12:42.104976 IP lamp-s-1vcpu-1gb-tor1-01.ssh > 198.96.85.21.63664: Flags [P.], seq 31358428:31358600, ack 17461, win 313, length 172
15:12:42.105030 IP lamp-s-1vcpu-1gb-tor1-01.ssh > 198.96.85.21.63664: Flags [P.], seq 31358600:31358772, ack 17461, win 313, length 172
15:12:42.105086 IP lamp-s-1vcpu-1gb-tor1-01.ssh > 198.96.85.21.63664: Flags [P.], seq 31358772:31358944, ack 17461, win 313, length 172
15:12:42.105140 IP lamp-s-1vcpu-1gb-tor1-01.ssh > 198.96.85.21.63664: Flags [P.], seq 31358944:31359116, ack 17461, win 313, length 172
15:12:42.105195 IP lamp-s-1vcpu-1gb-tor1-01.ssh > 198.96.85.21.63664: Flags [P.], seq 31359116:31359288, ack 17461, win 313, length 172
15:12:42.105271 IP lamp-s-1vcpu-1gb-tor1-01.ssh > 198.96.85.21.63664: Flags [P.], seq 31359288:31359460, ack 17461, win 313, length 172
15:12:42.105352 IP lamp-s-1vcpu-1gb-tor1-01.ssh > 198.96.85.21.63664: Flags [P.], seq 31359460:31359632, ack 17461, win 313, length 172
15:12:42.105426 IP lamp-s-1vcpu-1gb-tor1-01.ssh > 198.96.85.21.63664: Flags [P.], seq 31359632:31359804, ack 17461, win 313, length 172
15:12:42.105500 IP lamp-s-1vcpu-1gb-tor1-01.ssh > 198.96.85.21.63664: Flags [P.], seq 31359804:31359976, ack 17461, win 313, length 172
15:12:42.105565 IP lamp-s-1vcpu-1gb-tor1-01.ssh > 198.96.85.21.63664: Flags [P.], seq 31359976:31360148, ack 17461, win 313, length 172
15:12:42.105622 IP lamp-s-1vcpu-1gb-tor1-01.ssh > 198.96.85.21.63664: Flags [P.], seq 31360148:31360320, ack 17461, win 313, length 172
15:12:42.105677 IP lamp-s-1vcpu-1gb-tor1-01.ssh > 198.96.85.21.63664: Flags [P.], seq 31360320:31360492, ack 17461, win 313, length 172
15:12:42.105757 IP lamp-s-1vcpu-1gb-tor1-01.ssh > 198.96.85.21.63664: Flags [P.], seq 31360492:31360664, ack 17461, win 313, length 172
15:12:42.105835 IP lamp-s-1vcpu-1gb-tor1-01.ssh > 198.96.85.21.63664: Flags [P.], seq 31360664:31360836, ack 17461, win 313, length 172
15:12:42.105906 IP lamp-s-1vcpu-1gb-tor1-01.ssh > 198.96.85.21.63664: Flags [P.], seq 31360836:31361008, ack 17461, win 313, length 172
15:12:42.105997 IP lamp-s-1vcpu-1gb-tor1-01.ssh > 198.96.85.21.63664: Flags [P.], seq 31361008:31361180, ack 17461, win 313, length 172
15:12:42.106065 IP lamp-s-1vcpu-1gb-tor1-01.ssh > 198.96.85.21.63664: Flags [P.], seq 31361180:31361352, ack 17461, win 313, length 172
